{
  "schemaVersion": "curl-runtime-profile/v1",
  "curlVersion": "8.20.0",
  "protocols": [
    "dict",
    "file",
    "ftp",
    "ftps",
    "gopher",
    "gophers",
    "http",
    "https",
    "imap",
    "imaps",
    "ipfs",
    "ipns",
    "mqtt",
    "mqtts",
    "pop3",
    "pop3s",
    "rtsp",
    "scp",
    "sftp",
    "smtp",
    "smtps",
    "telnet",
    "tftp"
  ],
  "features": [
    "alt-svc",
    "AsynchDNS",
    "brotli",
    "GSS-API",
    "HSTS",
    "HTTP2",
    "HTTP3",
    "HTTPS-proxy",
    "IDN",
    "IPv6",
    "Kerberos",
    "Largefile",
    "libz",
    "PSL",
    "SPNEGO",
    "SSL",
    "threadsafe",
    "TLS-SRP",
    "UnixSockets",
    "zstd"
  ],
  "compile": {
    "availableOptions": null,
    "disabledOptions": [],
    "defines": []
  },
  "optionCatalog": {
    "curlVersion": "8.20.0",
    "source": "build/generated/options-8.20.0.json",
    "sha256": "413ecc7f3a2639a99e1f5a9dc5e121145c8a48777a7c2464cce3fca2694e0ae3"
  },
  "sslBackend": "openssl",
  "http3Backend": "ngtcp2",
  "resolverBackend": "c-ares",
  "defaults": {
    "userAgent": null,
    "httpVersion": null,
    "followRedirects": false
  }
}
